title,created_utc,score,num_comments,comments,periods,sentiment_score,sentiment_label
"Fed should pay every American more, let hedge funds and billionaires ‘get wiped out,’ says Social Capital CEO | ‘What we’ve done is disproportionately prop up poor-performing CEOs and boards,’ Chamath Palihapitiya tells CNBC",2020-04-10 11:32:43+00:00,89461,4124,"[{'author': 'harpsm', 'body': 'These big corporations need to pull themselves up by their boot straps.  Handouts will only encourage them to be lazy and reliant on government.  Just work harder!  \n\n/s, sort of', 'score': 5775, 'sentiment_score': 0.3802, 'sentiment_label': 'positive'}, {'author': 'mycatisblackandtan', 'body': ""He's not wrong. If all the stimulus packages that Congress was throwing at Wall Street went to the average citizen instead, we likely wouldn't be seeing the wide scale economic collapse that we are right now. It's hilarious to me that people who can barely afford to put $10 a month away in savings are essentially being told they should have saved four months rent for these kind of situations - but the people WITH money are having their crocodile tears dried with $100 bills by the government. Let THEM prop themselves up. Take care of the little guy instead."", 'score': 10180, 'sentiment_score': 0.6572, 'sentiment_label': 'positive'}, {'author': 'TonyPerkisReddit4', 'body': 'Their bonus incentives are what causes them to focus on short term profits while sacrificing long term. Which inevitably leads to their firing/resignation. Rinse repeat. Not too dissimilar to our politics. The common denominator is the shareholders are also voters. They follow us but we refuse to accept how we contribute to whatever problem we see', 'score': 785, 'sentiment_score': 0.2263, 'sentiment_label': 'positive'}, {'author': 'UltraMegaMegaMan', 'body': 'Rich people? *Consequences*???\n\nSeems un-American.', 'score': 48, 'sentiment_score': 0.6767, 'sentiment_label': 'positive'}, {'author': 'RichGuess', 'body': 'Is the Fed’s massive coronavirus stimulus package helping the ultra-rich at the expense of ordinary American workers? That’s what Chamath Palihapitiya, chief executive of venture-capital firm Social Capital LP, argued Thursday.\n\nAppearing Thursday on CNBC’s “Fast Money Halftime Report” Palihapitiya said the U.S. shouldn’t be bailing out billionaires and hedge funds when it’s the people on Main Street who are the ones actually getting hurt.\n\nJobless claims hit nearly 17 million on Thursday, and are likely even higher as businesses across the country close in an effort to slow the spread of COVID-19. Economists say the unemployment rate has likely surged above 10% and will only get worse.\n\nPalihapitiya’s argument, basically, is: Let those businesses fail, but without layoffs, and let the rich stakeholders absorb the pain.\n\nWhen a business typically fails, Palihapitiya said, “it does not fire their employees,” instead going though a bankruptcy process that often preserves pensions, and employees end up owning more of the company in the end.\n\n“The people who get wiped out are the speculators” who own debt, and the equity holders. “These are the people that purport to be the most sophisticated investors in the world. They deserve to get wiped out,” Palihapitiya said. “But he employees don’t get wiped out. The pensions typically don’t get wiped out.”\n\nA baffled Scott Wapner, the show’s host, asked why anyone “deserves” to get wiped out.\n\n“Just to be clear on who we are talking about. We’re talking about a hedge fund that serves a bunch of billionaire family offices. Who cares? They don’t get the summer in the Hamptons?” Palihapitiya said. “Who cares? Let them get wiped out.”\n\n“What we’ve done is disproportionately prop up poor-performing CEOs and boards, and you have to wash these people out,” he said.\n\nThe Fed on Thursday set up a new $2.3 trillion lending program to help prop up small and mid-sized businesses.\n\nBut Palihapitiya argued that rather giving workers relatively small $1,200 checks, the U.S. would be better off giving everyone larger payments directly, and skip businesses entirely.\n\n“It would be better for the Fed to have given half a million to every man, woman and child in the United States,” he said.\n\nLater, Palihapitiya tweeted that Americans should also get their 2019 taxes refunded as a form of universal basic income.', 'score': 456, 'sentiment_score': 0.9783, 'sentiment_label': 'positive'}, {'author': 'McThrice', 'body': ""Fuck the corporate bailouts. If they're struggling, they can do what the vast majority of American business owners are forced to do: file for chapter 11 bankruptcy. Operations continue uninterrupted, but the piss-poor management loses control to the creditors. The American taxpayer shouldn't have to shoulder the burden of a company's or industry's financial mismanagement of stock buy-backs to artificially inflate value to appease shareholders. Fuck those shareholders for making a terrible investment in a company propped up on debt. \n\nhttps://youtu.be/JdGNoHg_Na0"", 'score': 112, 'sentiment_score': -0.9604, 'sentiment_label': 'negative'}, {'author': 'BuckRowdy', 'body': ""That's because Americans fetishize CEOs, celebrities, and wealthy people and think they're better than the rest of us. The entire thrust of America has ingrained that in our DNA.  \n\nThere is no one Americans hate more than their fellow Americans who are not in one of those three groups."", 'score': 1273, 'sentiment_score': -0.128, 'sentiment_label': 'negative'}, {'author': 'zombiesingularity', 'body': 'The host pushed back saying that they should get bailed out because ""its not their fault"". Try telling that to a landlord as a normal person, they won\'t care. Try telling the bank you can\'t pay because you were laid off through no fault of your own. They won\'t bail you out, they\'ll say ""life\'s unfair"" and take your house. But somehow when massive corporations hit hard times we immediately give them trillions. Disgusting.', 'score': 40, 'sentiment_score': -0.8851, 'sentiment_label': 'negative'}, {'author': 'CySnark', 'body': ""Politicians give our money to businesses who give our money back to the politicians for their re-election. \n\nIt's the circle of life."", 'score': 32, 'sentiment_score': 0.0, 'sentiment_label': 'neutral'}]","['covid_rebound', 'early_stage', 'early_stage', 'early_stage']",-0.1027,negative
Billionaire Chamath Palihapitiya says big companies shouldn't receive a 'single extra dollar' of stimulus and Congress should pay ordinary Americans instead,2020-10-01 14:02:21+00:00,17102,348,"[{'author': 'AutoModerator', 'body': ""\nRegister to vote or check your registration status **[here](https://www.vote.gov/)**. Plan your vote: **[Early voting](https://www.ncsl.org/research/elections-and-campaigns/early-voting-in-state-elections.aspx)** | **[Mail in voting](https://www.npr.org/2020/09/14/909338758/map-mail-in-voting-rules-by-state)**.\n\n---\n\nAs a reminder, this subreddit [is for civil discussion.](/r/politics/wiki/index#wiki_be_civil)\n\nIn general, be courteous to others. Debate/discuss/argue the merits of ideas, don't attack people. Personal insults, shill or troll accusations, hate speech, **any** advocating or wishing death/physical harm, and other rule violations can result in a permanent ban. \n\nIf you see comments in violation of our rules, please report them.\n\n For those who have questions regarding any media outlets being posted on this subreddit, please click [here](https://www.reddit.com/r/politics/wiki/approveddomainslist) to review our details as to our approved domains list and outlet criteria.\n\n***\n\n\n*I am a bot, and this action was performed automatically. Please [contact the moderators of this subreddit](/message/compose/?to=/r/politics) if you have any questions or concerns.*"", 'score': 1, 'sentiment_score': -0.6537, 'sentiment_label': 'negative'}, {'author': 'hildebrand_rarity', 'body': '>\t""Give money to ordinary Americans, priority number one.  Priority number two, give money to small businesses. But do not start ripping any more money into these big companies.  They don\'t know what to do with it,"" the billionaire said.\n\nCongress didn’t hesitate to bailout big business during this crisis yet millions of Americans are still unemployed and on the verge of losing everything and we still haven’t given them the aid they so desperately need.', 'score': 1319, 'sentiment_score': -0.9623, 'sentiment_label': 'negative'}, {'author': '6squareddabsmaf', 'body': ""Worth watching if you haven't seen it: https://www.youtube.com/watch?v=qAt7Rg1u2l8"", 'score': 147, 'sentiment_score': 0.2263, 'sentiment_label': 'positive'}, {'author': 'cult45alt', 'body': ""Has it really escaped Trump's reality that providing aid for the people would get him more votes?"", 'score': 214, 'sentiment_score': 0.0, 'sentiment_label': 'neutral'}, {'author': 'None', 'body': ""There shouldn't be any stimulus for publicly traded companies."", 'score': 100, 'sentiment_score': 0.0, 'sentiment_label': 'neutral'}, {'author': 'TheHomersapien', 'body': ""The issue of stimulus isn't about whether money should be given, its about controlling where the money goes after it is given.\n\n$1,200 in the pocket of a median earner goes directly back into the economy. That is without question. The problem is that corporations don't get to control it, and that just is no good for their fake, government subsidized capitalism."", 'score': 72, 'sentiment_score': -0.0366, 'sentiment_label': 'neutral'}, {'author': 'autotldr', 'body': 'This is the best tl;dr I could make, [original](https://markets.businessinsider.com/news/stocks/congress-stimulus-chamath-palihapitiya-large-corporations-pay-ordinary-americans-economy-2020-10-1029640514) reduced by 69%. (I\'m a bot)\n*****\n> Billionaire investor Chamath Palihapitiya said large corporations should not receive a &quot;Single extra dollar&quot; of stimulus and Congress should prioritize putting money in Americans&#039; pockets instead.At the CNBC Institutional Investor Delivering Alpha conference Palihapitiya criticized the &quot;Idiotic forms of capital allocation&quot; of big companies.\n\n> &quot;Give money to ordinary Americans, priority number one. Priority number two, give money to small businesses. But do not start ripping any more money into these big companies. They don&#039;t know what to do with it,&quot; the billionaire said.\n\n> Billionaire Chamath Palihapitiya criticized capital allocation of large corporations and said the government shouldn&#039;t give them a &quot;Single extra dollar&quot; but focus on paying ordinary Americans instead. He made the comments during a panel at the CNBC Institutional Investor Delivering Alpha conference on Wednesday.\n\n\n*****\n[**Extended Summary**](http://np.reddit.com/r/autotldr/comments/j3a896/billionaire_chamath_palihapitiya_says_big/) | [FAQ](http://np.reddit.com/r/autotldr/comments/31b9fm/faq_autotldr_bot/ ""Version 2.02, ~528462 tl;drs so far."") | [Feedback](http://np.reddit.com/message/compose?to=%23autotldr ""PM\'s and comments are monitored, constructive feedback is welcome."") | *Top* *keywords*: **money**^#1 **give**^#2 **Americans**^#3 **capital**^#4 **Palihapitiya**^#5', 'score': 17, 'sentiment_score': -0.2732, 'sentiment_label': 'negative'}, {'author': 'financewiz', 'body': 'Again, if you’re not paying people to stay home and quarantine then you are not actually combating the spread of the virus. If you are not making certain that the entire population has access to testing and medical care then you are not actually combating the spread of the virus.', 'score': 31, 'sentiment_score': 0.3369, 'sentiment_label': 'positive'}, {'author': 'ErandurVane', 'body': ""I've always hated the idea of bailing out big businesses. If the business couldn't adapt to the market, why should it be bailed out by the government just because it's big? Instead you should bail out people and small businesses because they are the foundation of our economy. Money trickles up the chain, not down it like Reagan said. If you strengthen the foundation of your economy and make all your citizens prosperous, then your economy will be much stronger than the leaning tower of pisa we have now"", 'score': 19, 'sentiment_score': 0.224, 'sentiment_label': 'positive'}, {'author': 'whitehypeman', 'body': ""We're close to all time highs in the stock market. They have plenty of money already!"", 'score': 13, 'sentiment_score': 0.0, 'sentiment_label': 'neutral'}]","['covid_rebound', 'early_stage', 'early_stage', 'early_stage']",-0.1027,negative
Alexandria Ocasio-Cortez will discuss the GameStop and Robinhood trading drama with Chamath Palihapitiya on Twitch,2021-01-29 01:04:53+00:00,754,37,"[{'author': 'AutoModerator', 'body': ""\nAs a reminder, this subreddit [is for civil discussion.](/r/politics/wiki/index#wiki_be_civil)\n\nIn general, be courteous to others. Debate/discuss/argue the merits of ideas, don't attack people. Personal insults, shill or troll accusations, hate speech, **any** advocating or wishing death/physical harm, and other rule violations can result in a permanent ban. \n\nIf you see comments in violation of our rules, please report them.\n\n For those who have questions regarding any media outlets being posted on this subreddit, please click [here](https://www.reddit.com/r/politics/wiki/approveddomainslist) to review our details as to our approved domains list and outlet criteria.\n\n***\n\n\n*I am a bot, and this action was performed automatically. Please [contact the moderators of this subreddit](/message/compose/?to=/r/politics) if you have any questions or concerns.*"", 'score': 1, 'sentiment_score': -0.6537, 'sentiment_label': 'negative'}, {'author': 'PIA_Redditor', 'body': 'I just joined a class action lawsuit against Robinhood.', 'score': 31, 'sentiment_score': -0.2263, 'sentiment_label': 'negative'}, {'author': 'HighburyOnStrand', 'body': ""New rule:\n\nIf you're a conservative and you're anti-immigration, you're not allowed to revel in Chamath Palihapitiya's support of retail investment.  \n\nListen to this dude for 20 minutes and tell me his presence in this country isn't a blessing.  Morons."", 'score': 44, 'sentiment_score': 0.2579, 'sentiment_label': 'positive'}, {'author': 'agentup', 'body': 'The chat is trying to make DOGE buys happen', 'score': 12, 'sentiment_score': 0.0, 'sentiment_label': 'neutral'}, {'author': 'Karma-Kosmonaut', 'body': '>Following days of Reddit-fueled trading of volatile stocks and the subsequent trading freezes imposed by the fee-free stock trading app, Robinhood, Rep. Alexandria Ocasio-Cortez tweeted that she will discuss the recent developments on the livestream video service, Twitch, Thursday night at 8:30 p.m. EST.', 'score': 6, 'sentiment_score': -0.1027, 'sentiment_label': 'negative'}, {'author': 'Old_Air_5661', 'body': 'One with the people. My Queen.', 'score': 8, 'sentiment_score': 0.0, 'sentiment_label': 'neutral'}, {'author': 'stanbeard', 'body': 'I read ""AOC will discuss GameStop and Robinhood trading drama with Chairman Palpatine on Twitch"" for a moment.', 'score': 2, 'sentiment_score': 0.0, 'sentiment_label': 'neutral'}, {'author': 'veryblanduser', 'body': 'Chamath is one of the good ones.', 'score': 4, 'sentiment_score': 0.4404, 'sentiment_label': 'positive'}, {'author': 'YourMomAteMyDad', 'body': "">[Frazzledrip QAnon Pizzagate Executing Pelosi 'Islamic invasion' Rothschild laser beam And much, much more... I summarized almost everything crazy/offensive/bigoted that GOP Congresswoman Marjorie Taylor Greene has said or done in 60 seconds flat. Watch:](https://twitter.com/mehdirhasan/status/1354958513664090113)"", 'score': 1, 'sentiment_score': 0.0, 'sentiment_label': 'neutral'}]","['2025_and_beyond', 'pre_peak', 'early_stage', 'early_stage']",0.0,neutral
Billionaire Chamath Palihapitiya says the Fed and Treasury's actions at the start of coronavirus were a 6-week-long 'drunken binge',2020-06-19 10:27:32+00:00,176,16,"[{'author': 'bread_n_butter_2k', 'body': ""This CEO tells it more like it really is. Most corporate execs must disdain him. The wealthy businesses and families don't need taxpayer dollars as much as the bottom 80%. If they had used the taxpayer's **t**rillions to give every adult citizen an [UBI](https://en.wikipedia.org/wiki/Basic_income) every month, then that would have charged up the economy in every locality. The wealthy businesses would compete for the UBI dollars anyway. \n\n\nMr. Mugatu: [I feel like I'm taking crazy pills!](https://www.youtube.com/watch?v=llgY3VBwTAo)\n\nEdit: Does your Senator support the [Monthly Economic Crisis Support Act](https://www.politico.com/news/2020/05/08/monthly-payments-2000-coronavirus-243670)? Up to **$10,000 cash** every month for US families!"", 'score': 13, 'sentiment_score': 0.6736, 'sentiment_label': 'positive'}, {'author': 'anthropicprincipal', 'body': 'Compared to what?  We let the great recession fester for 10 months before a bailout, and that sucked.', 'score': 10, 'sentiment_score': -0.2732, 'sentiment_label': 'negative'}, {'author': 'AutoModerator', 'body': ""\nAs a reminder, this subreddit [is for civil discussion.](/r/politics/wiki/index#wiki_be_civil)\n\nIn general, be courteous to others. Debate/discuss/argue the merits of ideas, don't attack people. Personal insults, shill or troll accusations, hate speech, **any** advocating or wishing death/physical harm, and other rule violations can result in a permanent ban. \n\nIf you see comments in violation of our rules, please report them.\n\n For those who have questions regarding any media outlets being posted on this subreddit, please click [here](https://www.reddit.com/r/politics/wiki/whitelist) to review our details as to whitelist and outlet criteria.\n\n***\n\n\n*I am a bot, and this action was performed automatically. Please [contact the moderators of this subreddit](/message/compose/?to=/r/politics) if you have any questions or concerns.*"", 'score': 1, 'sentiment_score': -0.799, 'sentiment_label': 'negative'}, {'author': 'JrYo13', 'body': ""I don't think people can really grasp the enormity of 2 trillion dollars is the problem. There are roughly 330 million Americans, with 1 billion dollars you could give every american 3 million dollars. With one trillion you can give 3 billion dollars to every American. With 2 trillion you can give out 6 billion to each American. The government straight up showed us that with the money they had to throw around they could have long ago ended poverty in America. All of this we go through is just about class, they need people lower on the ladder just to have someone to shit on."", 'score': -6, 'sentiment_score': -0.872, 'sentiment_label': 'negative'}]","['covid_rebound', 'early_stage', 'early_stage', 'early_stage']",0.0,neutral
"A neck-and-neck US election goes to show that Democrats need to do some soul-searching, billionaire Chamath Palihapitiya says",2020-11-04 20:03:07+00:00,86,105,"[{'author': 'AutoModerator', 'body': ""\nAs a reminder, this subreddit [is for civil discussion.](/r/politics/wiki/index#wiki_be_civil)\n\nIn general, be courteous to others. Debate/discuss/argue the merits of ideas, don't attack people. Personal insults, shill or troll accusations, hate speech, **any** advocating or wishing death/physical harm, and other rule violations can result in a permanent ban. \n\nIf you see comments in violation of our rules, please report them.\n\n For those who have questions regarding any media outlets being posted on this subreddit, please click [here](https://www.reddit.com/r/politics/wiki/approveddomainslist) to review our details as to our approved domains list and outlet criteria.\n\n***\n\n\n*I am a bot, and this action was performed automatically. Please [contact the moderators of this subreddit](/message/compose/?to=/r/politics) if you have any questions or concerns.*"", 'score': 1, 'sentiment_score': -0.6537, 'sentiment_label': 'negative'}, {'author': 'my-other-name', 'body': 'Definitely feels like it was an Anti-Trump vote as opposed to a Pro-Biden vote.', 'score': 52, 'sentiment_score': 0.6369, 'sentiment_label': 'positive'}, {'author': 'None', 'body': 'why the fuck would i give a shit about shitty advice given by some billionaire \n\ni want healthcare and college', 'score': 82, 'sentiment_score': -0.886, 'sentiment_label': 'negative'}, {'author': 'Balls_of_Adamanthium', 'body': 'We need new blood. Move on from Pelosi and Chuck and bring new blood that’s not into the “compromise” bullshit and willing to embrace progressive ideas. This was a major fuckup from the DNC.', 'score': 34, 'sentiment_score': -0.3612, 'sentiment_label': 'negative'}, {'author': 'None', 'body': ""Reject identity politics, embrace the language of class. Support unions and worker rights. Don't insult the religious, but show them firmly that their religion isn't above the law. Show that the love for the environment is more than skin deep. Raise taxes on the rich, invest in infrastructure. Elect a real progressive next time."", 'score': 13, 'sentiment_score': 0.9349, 'sentiment_label': 'positive'}, {'author': 'ButtEatingContest', 'body': '> He said the COVID-19 lockdowns and an overemphasis on ""cancel culture"" instead of ""thinking about just common, everyday problems"" had hurt the Democratic nominee Joe Biden\'s chance of winning.\n\nWho gives a shit what some alt-right spewing garbage-clown has to say?', 'score': 22, 'sentiment_score': -0.743, 'sentiment_label': 'negative'}, {'author': 'whiskeypenguin', 'body': 'The DNC is broken. Our country is broken. Even though I voted for Biden, he isn’t the solution.', 'score': 6, 'sentiment_score': -0.5994, 'sentiment_label': 'negative'}, {'author': 'zaparthes', 'body': ""Defeating an incumbent President is always very difficult, especially one built around a cult of personality with a fanaticism unseen previously in American history. Yet what we have now is that a clear majority of Americans have shown that they *do not* support Trump, that they *do not wish* for him to have a second term, and it's the *Democrats* who have soul-searching to do?"", 'score': 4, 'sentiment_score': -0.024, 'sentiment_label': 'neutral'}, {'author': 'None', 'body': 'Or maybe Republicans need to stop following a leader who is pure evil?', 'score': 11, 'sentiment_score': -0.765, 'sentiment_label': 'negative'}]","['2025_and_beyond', 'early_stage', 'early_stage', 'early_stage']",0.0,neutral
Chamath Palihapitiya: We’ve ‘ripped the philosophical band-aid off’ on universal basic income,2020-04-24 06:40:22+00:00,69,16,"[{'author': 'grpagrati', 'body': ""It's not the philosophical band-aid that's the problem"", 'score': 2, 'sentiment_score': -0.4019, 'sentiment_label': 'negative'}, {'author': 'AutoModerator', 'body': ""\nAs a reminder, this subreddit [is for civil discussion.](/r/politics/wiki/index#wiki_be_civil)\n\nIn general, be courteous to others. Debate/discuss/argue the merits of ideas, don't attack people. Personal insults, shill or troll accusations, hate speech, **any** advocating or wishing death/physical harm, and other rule violations can result in a permanent ban. \n\nIf you see comments in violation of our rules, please report them.\n\n For those who have questions regarding any media outlets being posted on this subreddit, please click [here](https://www.reddit.com/r/politics/wiki/whitelist) to review our details as to whitelist and outlet criteria.\n\n***\n\n\n*I am a bot, and this action was performed automatically. Please [contact the moderators of this subreddit](/message/compose/?to=/r/politics) if you have any questions or concerns.*"", 'score': 1, 'sentiment_score': -0.799, 'sentiment_label': 'negative'}, {'author': 'pw1313', 'body': 'He is exactly the kind of President we need.  Too bad he does not live here.', 'score': 1, 'sentiment_score': -0.5423, 'sentiment_label': 'negative'}, {'author': 'The_Umpire_Lestat', 'body': 'In the great body politic, UBI would simply ensure the Invisible Hand has full vascular circulation.', 'score': 1, 'sentiment_score': 0.872, 'sentiment_label': 'positive'}, {'author': 'prop_synch', 'body': ""I'm sot sure who this guy is but I heard him talking about airlines earlier in the week.  He was factually wrong about nearly everything except for the names of the airlines."", 'score': -8, 'sentiment_score': -0.5423, 'sentiment_label': 'negative'}]","['covid_rebound', 'early_stage', 'early_stage', 'early_stage']",0.0,neutral
